{
  "schema_version": 1,
  "snapshot_id": "dddddddd-dddd-4ddd-8ddd-dddddddddddd",
  "user_id": "demo-user-1",
  "capture_reason": "monitoring_started",
  "captured_at": "2026-07-18T14:32:10Z",
  "items": [
    {
      "metric_type": "heart_rate",
      "metric": {
        "schema_version": 1,
        "metric_id": "11111111-1111-4111-8111-111111111111",
        "user_id": "demo-user-1",
        "metric_type": "heart_rate",
        "acquisition_class": "live",
        "value": 108.0,
        "unit": "count/min",
        "observed_at": "2026-07-18T14:32:05Z",
        "source": "apple_live_workout",
        "source_kind": "apple_live_workout",
        "source_name": "Demo Apple Watch",
        "source_bundle_id": "com.example.vitalrelay",
        "device_model": "Apple Watch",
        "simulated": false,
        "quality": "good",
        "used_for_escalation": false
      },
      "capability": {
        "schema_version": 1,
        "capability_id": "c1111111-1111-4111-8111-111111111111",
        "user_id": "demo-user-1",
        "metric_type": "heart_rate",
        "acquisition_class": "live",
        "status": "available",
        "checked_at": "2026-07-18T14:32:06Z",
        "source": "apple_live_workout",
        "source_kind": "apple_live_workout",
        "source_name": "Demo Apple Watch",
        "source_bundle_id": "com.example.vitalrelay",
        "device_model": "Apple Watch",
        "simulated": false,
        "error_code": null,
        "used_for_escalation": false
      },
      "availability": "available",
      "freshness": "live",
      "age_seconds": 5,
      "live_window_seconds": 15,
      "recent_window_seconds": 86400,
      "used_for_escalation": false
    },
    {
      "metric_type": "oxygen_saturation",
      "metric": null,
      "capability": {
        "schema_version": 1,
        "capability_id": "c3333333-3333-4333-8333-333333333333",
        "user_id": "demo-user-1",
        "metric_type": "oxygen_saturation",
        "acquisition_class": "recent_context",
        "status": "requested_no_sample",
        "checked_at": "2026-07-18T14:32:06Z",
        "source": "apple_healthkit",
        "source_kind": "apple_healthkit",
        "source_name": "Demo Apple Watch",
        "source_bundle_id": "com.apple.health",
        "device_model": "Apple Watch",
        "simulated": false,
        "error_code": null,
        "used_for_escalation": false
      },
      "availability": "requested_no_sample",
      "freshness": "unavailable",
      "age_seconds": null,
      "live_window_seconds": 15,
      "recent_window_seconds": 86400,
      "used_for_escalation": false
    },
    {
      "metric_type": "respiratory_rate",
      "metric": {
        "schema_version": 1,
        "metric_id": "22222222-2222-4222-8222-222222222222",
        "user_id": "demo-user-1",
        "metric_type": "respiratory_rate",
        "acquisition_class": "recent_context",
        "value": 16.0,
        "unit": "count/min",
        "observed_at": "2026-07-18T08:10:00Z",
        "source": "apple_healthkit",
        "source_kind": "apple_healthkit",
        "source_name": "Demo Apple Watch",
        "source_bundle_id": "com.apple.health",
        "device_model": "Apple Watch",
        "simulated": false,
        "quality": null,
        "used_for_escalation": false
      },
      "capability": {
        "schema_version": 1,
        "capability_id": "c2222222-2222-4222-8222-222222222222",
        "user_id": "demo-user-1",
        "metric_type": "respiratory_rate",
        "acquisition_class": "recent_context",
        "status": "available",
        "checked_at": "2026-07-18T14:32:06Z",
        "source": "apple_healthkit",
        "source_kind": "apple_healthkit",
        "source_name": "Demo Apple Watch",
        "source_bundle_id": "com.apple.health",
        "device_model": "Apple Watch",
        "simulated": false,
        "error_code": null,
        "used_for_escalation": false
      },
      "availability": "available",
      "freshness": "recent",
      "age_seconds": 22930,
      "live_window_seconds": 15,
      "recent_window_seconds": 86400,
      "used_for_escalation": false
    },
    {
      "metric_type": "step_count",
      "metric": {
        "schema_version": 1,
        "metric_id": "44444444-4444-4444-8444-444444444444",
        "user_id": "demo-user-1",
        "metric_type": "step_count",
        "acquisition_class": "recent_context",
        "value": 2450.0,
        "unit": "count",
        "observed_at": "2026-07-18T14:30:00Z",
        "source": "replay_pedometer",
        "source_kind": "replay",
        "source_name": "Deterministic demo fixture",
        "source_bundle_id": null,
        "device_model": null,
        "simulated": true,
        "quality": "good",
        "used_for_escalation": false
      },
      "capability": {
        "schema_version": 1,
        "capability_id": "c4444444-4444-4444-8444-444444444444",
        "user_id": "demo-user-1",
        "metric_type": "step_count",
        "acquisition_class": "recent_context",
        "status": "available",
        "checked_at": "2026-07-18T14:32:06Z",
        "source": "replay_pedometer",
        "source_kind": "replay",
        "source_name": "Deterministic demo fixture",
        "source_bundle_id": null,
        "device_model": null,
        "simulated": true,
        "error_code": null,
        "used_for_escalation": false
      },
      "availability": "available",
      "freshness": "recent",
      "age_seconds": 130,
      "live_window_seconds": 15,
      "recent_window_seconds": 86400,
      "used_for_escalation": false
    },
    {
      "metric_type": "wrist_temperature",
      "metric": null,
      "capability": {
        "schema_version": 1,
        "capability_id": "c5555555-5555-4555-8555-555555555555",
        "user_id": "demo-user-1",
        "metric_type": "wrist_temperature",
        "acquisition_class": "recent_context",
        "status": "unsupported",
        "checked_at": "2026-07-18T14:32:06Z",
        "source": "apple_healthkit",
        "source_kind": "apple_healthkit",
        "source_name": "Demo Apple Watch",
        "source_bundle_id": "com.apple.health",
        "device_model": "Apple Watch",
        "simulated": false,
        "error_code": null,
        "used_for_escalation": false
      },
      "availability": "unsupported",
      "freshness": "unavailable",
      "age_seconds": null,
      "live_window_seconds": 15,
      "recent_window_seconds": 86400,
      "used_for_escalation": false
    }
  ],
  "used_for_escalation": false
}
